text,score
根本的なことを理解すれば、あとはそこから派生する内容なので自分の言葉でノートにまとめると理解しやすいと思います。,3.54
解法を理解するまで勉強してください この再履修は地獄です,3.18
分かりにくい 黒板の下に文字を書いていて見えない,2.9
磁場や電場について学ぶことができた,3.35
憲法の内容やできるまでの過程がよく分かった。,3.31
予習は必ず行ってください。テスト勉強のためにノートに書くことをおすすめします。 先生はとても優しいです。 居眠り、遅刻・欠席は点数が引かれます。気をつけてください。,3.57
最初の方はしっかりと授業に取り組むことができたが、途中から怠けてしまった。対面で受けたい授業でした。,3.36
資料を見て予習復習すること。,3.35
授業スピードが早くて大変だった。,3.61
好意的なコメント有難う御座います。より意欲的に学習できるように、実際のセキュリティや通信アプリに関連する内容を今後増やすようにします。,3.55
あらかじめ期限を確認し、バイトやサークル、試験と被らないようにスケジュール管理を徹底する！,3.48
対面では体を動かすことをすると思うが、オンラインだとモチベーションがあまり出なかった。 また課題の一週間の振り返りでは取り組んだこと、来週取り組むことの欄に400時は個人的に多く感じた。,3.28
単純な回答ですが、授業を真面目に受けることが大切です。,3.34
授業は毎授業ちゃんと確認して、教科書にマーカーを引いたりしていれば問題ないと思います。,3.53
ちゃんと質問しに行かないと再履修になる,3.2
物体の曲げ、たわみ、座屈、組み合わせ応力について学ぶことができた。,3.37
過去問は当てにならない。,3.55
教員へのコメントではありませんが，難しくて理解に苦しむ，ということもわからないでは無いです．とは言っても，C言語を用いることは事前に話していますし，3年後期の講義ですので，簡単なわけがありません．音の波形を作り出す，解析するということは，一般的なことではないため，講義で紹介したフリーソフトやサンプルコードを利用して学習して下さい．もちろん，教員への質問も歓迎します．,3.0
欠席は3回までなので気をつけてください,3.71
ヒントをくださったので、めげずに解くのを頑張れました。ありがとうございます。,3.41
毎回の小テストをすること,3.33
課題の提出の起源や過大の提出期限や本文のリスニングを忘れずにすること。,3.54
日本以外の国のことを知ることが出来たので良かったです。次は自分の足で海外にいって周りの文化の違いや様々な文化に触れようと思いました。,3.72
ペットボトルの説明のバリエーションを増やしてほしい。,3.51
あまり法律は詳しくなかったためとてもためになった。,3.38
十分な勉強をしないと全くついていけなくなる。,2.9
運動の機会だった レポートつらい,3.47
自分の体調管理を見直せる最後のチャンスかもしれません,3.5
グローバル化が進み日本人より外国人を多く見るようになった世の中にはなったので、異文化を理解し受け入れることが大切だと学んだ,3.12
要約が難しかったです。,3.25
赤文字がとても多いので大変です,3.39
テスト持ち込みありなので内職はしないように。もし内職がバレたらテスト持ち込み無しにされる可能性があります。,3.65
高校と全然違くて難しいかったです,3.52
レポートを提出しなければ単位が認められません。約二週間と提出までの期間は長いため、早めに取り組んでください。,3.66
配布されるデータやプリント、ソフトウェアなどを活用して理解しましょう。,3.36
できるまで反復。問題集と授業プリントの問題は完璧ぐらいまで解けないと厳しい。,3.19
コンピュータなのでひとつ間違うと全部やり直しになるので注意です,3.79
課題が溜まると地獄を見ます。,3.48
課題をやらないとたった一回の授業で終了するかもしれません,3.6
耳よくないと勉強すらできない,3.42
行政について知る機会は中々ないのでためになった。,3.57
予習していかないとついていけない。,3.27
課題をしっかり調べて提出すること,3.3
内容は難しく感じましたが、講義のスライドが分かりやすかったです。,2.84
授業の演習を理解しながら取り組み，分からない点をよく確認したり，復習を行えばJavaの仕組み等をよく理解できると思います．構文力を身につけるには，実際に独自のプログラムを分からない点を調べながら取り組めばよいと思います． 試験に関しては，授業をよく聞き，試験前に過去問を解いて確認すれば十分合格できると思います．,3.45
しっかりと先生の話を聞いたうえで、自分のできることに力を注入したほうが良い。 誘惑に負けて何事もおろそかにすることはいけない。,3.46
毎週なんでも相談室を利用させてもらっていたが、理解できたと自信を持てるレベルまで学習を修めることはできなかった。,3.35
プレレポート、レポートは必ず期限内に出すことと、実験は休まない。,3.6
毎回の小テストを通じて化学と生活について理解を深めることができたと思う。また、先生の映像を使った説明がとてもわかりやすく、また面白かったです。,3.44
オンライン授業のために様々な機材をそろえてくださったのでわかりやすくて良かったです。,3.5
ノートの取り忘れがないように、きちんと毎回取った方がいいです。,3.38
皆さんが苦手と思われる化学装置・物理・数学的な内容が多かったのですが、それなりに頑張ってくれたと思います。もう少し演習を増やしたかったのが、それができず心残りです（次年度の課題です）。化学工学の内容は、工場などで勤務するようになったら、よく直面する課題となります。是非、化学工学の内容を忘れないでおいてください。,3.43
日頃から勉強してないとテストで痛い目に遭います,3.65
課題の点数が意外と少ない。,3.63
黒板に板書しているときに、黒板の近くの電気をつけて欲しかったです。,3.2
授業毎に小テストがあるので理解がしやすかった,3.48
先生の話をしっかり聞いて、重要なポイントはメモを取った方が良い。復習と課題はきちんと取り組む。,3.6
計画的にレポートを終わらせてください。,3.58
課題は毎回怠らずにしたほうがいいです,3.51
繰り返しプログラムを組むことで問題が解けるので、一回でならなかったからといって諦めないでください。,3.68
レポートが多いのと講義の進むペースがとても早いと思いました。わからない人もたくさんいると思うので、ペースを落として講義をして欲しいです。,3.37
しっかりと事前学習をする前提だと感じた。 高校の内容のようにうまくいかなかったので苦しかった。,3.33
小テストがあることで授業への理解が深まりました。,3.58
後期おせわになりました。,3.52
レポート出しましょう。,3.2
明らかに履修者の人数が少なかったです。履修者自体は多いのでしょうが、教室にいる人数が少なかったです。あれは私の見間違いでしょうか？それとも本当に人数が少なかったのでしょうか？ではなぜ、履修者の割に教室にいる人数が少なかったのでしょうか？んん？？むむむ？？まさか？？ピ逃げしてるな？？？ん？？ってことです！,3.0
線形代数と解析の演習だったのでとくことが出来た。最後の問題が難しかったので解けない問題もあった。,3.56
毎回の課題と授業を大事に受けてください。,3.35
ろ先生だけ再テストないので、気をつけてください。即死入ってます。,3.68
* もっとスピードを上げてもいい --> ご意見、ありがとうございます。授業中でも説明したように、理解の早い人に申し訳ないが、できるだけ全員がわかるようにスピードを落としています。内心はスピードを上げてもっといろいろな内容を盛り込みたいですが。,3.4
板書を欠かさない。話をよく聞く。,3.21
環境経営についての専門用語や、製品の流れを確認することができました。,3.64
とても難しいです。プリントだけでなく動画もほしいです。,3.1
何個か難しい課題があったので苦戦しました。,3.4
マニアックすぎる。金属なんちゃらみたいな教科名にした方がいいと思う。大事なことは口でしか言いませんも意味がわからない。大事なら書いてもらってもいいですか？正直喋り方的に何を言いたいのか分からないことが多い。,3.37
行列式解けるようになりました。,3.51
テスト内容はテスト前に提示され、自分なりの答えを考える時間はあります。持ち込みは出来なかったはず。,3.61
技術者としての責任など思考の幅が広がった。,3.4
多面的に物事を捉えることが少し難しかったです。,3.6
自分からコミュニケーションを取りに行くことが大切です。,3.48
先生の動画を見ておけば理解できると思いました。 動画はとてもわかりやすかったです。,3.09
2月または4月に開講される午前免除講座を同時に受講するといいと思います。,3.47
講義内レポートがあり、自分の考えを記述する問題があるので、授業はしっかり聞いた方がいいです。,3.57
課題の提出時間の変更は伝えてほしかった。,3.26
机の上に荷物を置かない。,3.52
内容もっとを簡単にしてほしい。,3.53
cプログラミングの基礎が学べてよかったです。だんだんコードが複雑になってくると思いますがそれがちょっとおもしろくもあります。,3.67
ピ逃げしても授業中にいきなり感想を書くことがあります。,3.33
小テストが予定日通りに進まない,3.31
高校で物理をとっていなかったら、難しいです。,3.45
テスト持ち込み不可なのでしっかり勉強した方がいいと思います。,3.58
予習、復習はした方がいい,3.67
一年生の必修科目に化学Ⅰがあるが、化学Ⅰの講義では化学の基礎はすでに理解をしている前提で進められるため、不安な人はこの化学基礎科目を履修しておくことがおすすめ。,3.15
とにかくメモをとりましょう,3.33
2年次以降、プログラミングに関連する重要な科目が増えていきます。がんばってください。,3.63
ミニテストをちゃんと取り組んだ方がいい。 リスニングを何回もする,3.26
体調不良が多く、授業に追いていかれる一方でやる度にあまり復習があまりできておらず理解が深まっていないことが多かった。休んだ日の内容を自分で解いてなかった時は次の授業で何を言ってるのか分からずもったいない時間を過ごしてしまったこともあったから体調不良はしょうがないけどその代わりにその分の理解を自分でこれかれ深めていこうと思った。,3.6
全体的に難しく問題がいまいちよくわからないことがあったので難しそうな問題は解説をもう少し詳しく教えてくださるとありがたいです。＝＝＞どの辺りでしょうか。よくわからない部分があったときに質問してください。（時間が許す限り）つきあいます。,3.27
実験は、とても大変である。実験では、より円滑にスムーズに行えるよう、授業開始前には、道具を必ず準備しましょう。また、実験の説明もしっかり聞き、電子工学基礎実験のほうでは、必ず事前に動画を確認して器具の使い方を見ておきましょう。実験後の考察も適当に書くと再提出になるので、しっかり書いて、次の実験に影響が出ないように早めに終わらせることが大事です。,3.58
しっかり課題に取り組んだ後に答え合わせをしておくこと,3.65
しっかり先生の話を聞いて補足などもメモを取る。,3.49
環境法について学ぶことができた。訴訟のところが難しかった。,3.73
授業をしっかり聞くべきです,3.51
期限内に課題を提出する,3.58
ミクロ、家庭的な経済の回りの仕組みをまなんだ。,3.31
教科書のなかで重要なところには、印をつけたほうがいいと思います。,3.25
予習、完成レポートの提出とても大変でした。けっこう、実験で苦戦したので、もっとスムーズにできたらよかったと思います。,3.75
提出物を必ず出すこと。,3.32
電験目指すなら取っておくべき,3.54
よく話を聞いて置かなければなりません。,3.55
授業中に席を立ってはいけません,3.38
積分因子が難しかったです。理解がなかなか出来なかった。,3.51
workと小テストを忘れ図にしましょう,3.5
毎日のworkと確認テストの入力を忘れないように！,3.63
人間によって地球の環境にどのような影響があり、また環境が人間にどのようなことがあったのか知ることができた。,3.64
課題で何について書かないといけないのか授業を聴いていないと分からなくなるため、何が目的で作業しているのか考えることが必要。,3.54
いろいろな方向から問題を見れた,3.44
先生にわからないことで質問しても、解答が全く来ないのでしっかりとメールを確認して送ってほしい。授業の出席状況を毎週しっかりと更新してもらわないともし間違ってたときに言っても、何週間前のことなんて覚えてない可能性があるため、更新してほしい。,3.32
課題を期限内にやっておく。,3.3
やり方や公式が分かってもどういう原理なのか細かいところまでを理解することができてない。,3.53
前期、中盤試験と自分が思っていたより難しい内容であり、ただ学習するだけでは点数はとれないので大変でした。それぞれ２回行われたテストでは思っているような点数をとることができなかったので、救済処置として行われたキャンペーンでの点数補正を行いました。先生が始めにおっしゃっていたように非常に難しい内容でただ学習するだけでは合格できないことから、改めて自分からよりマインドの高い問題にチャレンジする重要性を理解できました。,2.9
貴重なコメントを有難うございます．今年度は慣れない遠隔講義で皆さんにも多くのご協力をお願いすることとなりました．そのような中，「資料や動画が分かり易かった」「説明が分かり易かった」「自分のペースでできた」などのコメントがあり，大変に安心しております．一方で，出席課題やチャレンジ課題，プログラミング課題の難易度のついてのご要望も大変に参考になります．対面講義では，ＴＡの学生さんのサポートがあったり，学習相談コーナーを設けたりと皆さんと接しながら分からない点を解決していく機会があるのですが，今年は同等の機会を設けることが難しく，掲示板やメールなどでの対応になってしまい，スピーディな解決策を効果的に届けることができなかったことを申し訳なく思っております．前期の講義で気づかされた様々な問題点を整理し，更なる講義品質の改善へ役立てていきたいと思います．,3.56
やり直し制度があるのは良かった,3.5
毎回出席して課題を提出すること,3.42
犯罪にならないだろうと思っていたことが犯罪として成立していたり、逆の場合もあった。 自分が犯罪に巻き込まれたり、加害者にならないように気をつけたい。,3.67
レポートが大変だったのでしっかり授業後も復讐を欠かさず頑張ってください。,2.76
課題提出と振り返りがんばれ,3.13
新型コロナウイルス感染症の影響により遠隔形式で授業を始めました．大学の対面授業拡大の方針を受けて対面授業に切り替えようと思いましたが，遠隔授業の継続を希望するご意見をいただき，さらに大雪による休講（授業日振替）もありましたので，結果として遠隔主体の授業形態になったように思います．授業動画による説明がわかりやすいというコメントも個人的にいただきました．ですが一方で，すべてmyFITの掲示でお伝えするためか，課題の提出締切を失念してしまって課題が未提出になったしまった方もいるようです．授業形態にかかわらず，課題の未提出を減らすことを次年度の課題にしたいと思います．,3.0
この科目は微分積分をかなり使うので、復習して臨むといいと思います。,3.73
分からないことがあれば友達かTAに相談しましょう。,3.66
書いて予習して小テストで復習することで、頭に軽く残るようになった。 予習の計算問題などの解答が書き写せない時があったので、もう少し書き写す時間が欲しい。,3.6
レジュメを全てプリントアウトするとかなりの量になるため、PCを用いて受講することを推奨する。,3.8
科目の中で一番難しかったです。前期で合格はまずないし自信がない科目でした。,3.78
課題の締め切り日がとても短くて大変でした。,3.42
通信を行う際にどのような通信が行われているか、また、どのようにして送信や受信を行なっているかがわかった。,3.62
自力で素早く解けるようになるまでとく。,3.11
講義中に線を引くよう促されたところには線を引いておこう,3.3
法律関係で難しいことが多かったですが、例えを使って説明されることによって、わかりやすく学ぶことができました。ありがとうございました。,3.43
話しを聞かないと分からんくなる,3.5
毎回の英語の授業を楽しんで受けることが出来ました。,3.44
英会話が苦手だったので難しいと感じました,3.07
しっかりと勉強しないと単位落とします。,2.73
本文を丁寧に解説されていてとても分かりやすかった。,3.45
動画がほとんど止まって見れなかったので基本的にMoodleから資料をチェックするだけでした。 小テストはそこそこですが、これで単位を落とされたらたまったもんじゃありません。 しかも最終レポートが毎授業で提示した参考文献を自らテストのために事前投資をしなければいけないのなら第一回目に示しておくべきでしょう。はっきり言って無意味な時間でした。,3.39
課題が非常に難しかった。,3.39
同じグループになった人とは積極的に話してレポートを進めておいた方がいいです。のちに大変な目に遭います。,3.52
時々聞き取れない時がある,3.56
４回に1回ほどテストがあるのでがんばってください,3.57
数学が苦手な人は少し難しく感じるかもしれません。,3.31
小テストのを解いて、提出するまでが30分程なのはとても怖かったです。 計算量が多くて、書く量も多いとき勉強していてもギリギリだったので、オンラインでの提出の時は、提出する時間を見込んで5分ほど長くした方がいいと思いました。,3.45
各分野で再試験を実施してほしい。,3.68
gisの利便性の高さを感じた。,3.55
書く時間が少し短いなと感じた。,3.62
文字がとても小さくて前の席にいても見えない時があった。特に図を書いたり、式を書く時に添え字があるときなどがとても見づらかったです。なので友人に見せてもらうなど板書を写すだけでも、とても時間がかかっていて、先生の話についていけてない時が多かったです。 課題でいきなり問題を解くのは大変だったので、授業中に例題を何問か出して欲しかったです。そうすれば理解も深まって行くと思いました。,3.23
途中でこの授業を取るのをやめてしまい申し訳ありませんでした。,3.31
哲学に興味があったのですが、この授業で学習する意欲をそがれました。 授業においては、先生の声が聞きずらく、板書は教科書を写しただけです。また、授業アンケートの自分に対する良い意見ばかりを20～30分話して自己満足をする姿も見受けられました。 かなり苦痛な授業でした。 有意義な大学生活を過ごしたい方は履修しないことを推奨します。,2.0
教科書に直接書き込みを入れておくとテストのときに見ることができる,3.62
対面じゃないのでやりにくかった。 解析Ⅰよりも難しかった。,3.0
ちゃんと提出物をだして期限を守ること,3.44
テストが記述方式なので、講義で学んだ内容を自分の意見として活用できるように復習に力を入れると良い,3.61
ノートが多すぎた。 図が書けない。,3.14
実技確認テスト1の得点が芳しくなかった学生の一部が、その直後から履修を諦めて欠席が続くようになっていることについて一言申し上げておきたいと思います。“諦めるのが早過ぎるし、理解する機会を自ら奪ってどうする！！” と思います。古今東西、教科書を熟読し、講義を聴くことが理解の要諦だと思います。私はJavaの前身とも言える、とあるプログラミング言語を、授業のアシスタントを数年続けること（すなわち同じ講義を何度も聴き続けること）によって、ようやく理解することができるようになった経験を持っています。,3.21
大学の数学は高校の数学に比べて理解するのが難しかった。εーδ論法が一番難しかった。,3.26
人によって出来る具合の差が大きい,3.5
授業のペースが早かったので復習が書かせませでした。,3.52
話が面白く眠くはならなかった,3.12
時間を守ることは社会常識です。バスや電車の日常的な遅延は言い訳として通用しません。遅延を考慮して行動してください。,3.51
中間なし。期末だけで評価、範囲が広すぎるので、スケジュール管理は必須。 内容も難しい。ちゃんと勉強しなければ、単位落とす,3.34
前期に習った行列に関する行列式や行列の簡約化などを思い出しながら解くことができた。,3.4
授業で使った資料を授業資料として配布して欲しい,3.42
レポート作りが大変だった。,3.54
英語で授業を進めるので難しかったです。,3.5
歴史が好きだと選択するべき,3.2
週に２回授業があってペースが速いと思ったが大丈夫だった。高校とやっていることは変わらないが微分積分を用いて問題を解くので計算が大変だった。,3.73
今までオンラインで授業を行っていたのに期末テストだけ対面となるのはあまり理解できない。期末を対面を行うのであれば後期はもちろん全面対面授業になるはずですが、後期もオンラインで行うとなった場合に今回の期末テストは感染のリスクが大きすぎるのではないかと思った。 他大学と本学のコロナへの対応し方が違っていすぎて、本学のコロナ感染に対する意識の低さを感じてしまった。中途半端に対面で授業やテストを行ったことが特にそう感じた。 具体的な他大学との対応の違いとしては授業をオンラインでやったのであれば期末もオンラインで行う、または代替レポートにするなどの措置をとっていたので本学もそのような動きを取ってほしかった。,3.16
交流の輪が広がるきっかけになると思います,3.5
回路の1.2をしっかり理解して下さい,3.75
