text,score
受験以降英語にほぼ触れることがなかったので忘れていることばかりで大変だった。日頃から英語は勉強しないといけないと実感した。,3.18
自分自身の歩数など意識したことがなかったので、知ることができてよかったのと自分の体調管理について考え直すことができました。,3.28
受けれるならば受けた方がいい,3.23
ある程度の意味は感じることができたけれど、将来のことについて細かく考えられたかと言われると迷う部分があった。,2.96
ネット環境などで提出物が送れなかったりする,3.52
タバコの有害性について再認識することができた。,3.46
myfitが重くログインできない時があったので課題提出の期限を伸ばして欲しい。,3.39
しっかり復習予習が必要です。,3.48
オンラインだったのでなんとも言えません。,3.05
どこが出るか毎回知りたい,3.28
黒板に書くやつはメモする,2.94
コメントごとに返信します（少し順序が入れ替わっています）。他の人のコメントにも重要な情報があるかと思います。ぜひ一読してみてください。,3.62
日本を代表する作家たちの作品や生涯について細かく解説していただきありがとうございます。文学に興味をより持つことができました。,3.4
板書しないとレポート解けないです,3.63
ノートをとることだけに集中していたら授業の内容が分からなくなってしまうので先生の話を聞くことを優先する必要があると思います。演習問題で出た問題は必ず解けるようにして試験に臨まないといけません。,3.53
データとアドレスの違いは躓きやすい箇所であると思われる。データは計算で使う、アドレスは中身の受け渡しで使うという覚え方で自分はプログラムを作っている。,3.6
写真などはメモできないので、スライドを授業資料としてクラスボックスに貼ってほしいです。,3.65
aimはちゃんと書きましょう。,3.58
プリントの提出をしましょう。 テストは自筆ノートのみなので板書がんばりましょう。 ピー逃げ絶対だめ！,3.27
プログラミングはやるのが大学が初だったがわかりやすかったし、面白かった。,3.5
恥をかいてでもわかるようになるまで、質問するべき。,3.68
他の人と協力して何かをするということがなかったので残念でした．,3.34
ノートをしっかりとるようにした方がいいと思う。,3.39
授業前に英文などの予習をしておく。,3.36
スライドを自分で作って発表したり、ディベートをしたりとグループワークが沢山出来て良い経験になりました。,3.72
教科書の内容を読み取りながら随時文法やイディオムの説明があり分かりやすかったと思う。,3.36
しっかり話を聞いていないと難しいです。,3.8
御意見ありがとうございました。 来年度以降の参考にさせていただきます。,3.46
何度も繰り返しとけば問題は解けるようになる。,3.57
付箋など使ってうまく教材を使うことが大事だと思います。,3.33
今年度は特にコロナ渦により対面での講義もほとんど無く、外の学生との交流もあまりありませんでした。そのためコミュニケーション基礎の対面講義で学生との交流ができ良かったと思っています。,3.47
講義が終わった週のうちに次講義の予習をしておく．,3.32
授業が進むに程段々と複雑なプログラムが増えていく為、1回の講義でできる限り理解を深めるようにしましょう。,3.45
席によっては黒板が見えず、どこを説明しているのかが分からない。,3.62
”調べても調べても専門用語、まさに専門用語のマトリョーシカ。”コメント，ありがとうございます．この表現，ウケました．,3.66
課題はギリギリにするのではなく、計画的に早めに取り組む方がいい。,3.0
頑張って理解してください,3.33
ほかの人たちが言いたいことは言っていると思うので私からは、あのメールでは納得がいきません。私たちは授業料を払っているので、せめて納得のいくような説明をしていただきたいと思います。,3.04
1日休んだ人が二度と来なくなったことがかなり印象深い。,3.13
授業で学習した内容と課題の内容が異なりすぎて、大変でした。,3.44
問題の答えがないから勉強したくても答えがあってるかわからなかった。,3.21
しっかり頑張ってください,3.45
知っておくと良い知識が得られるので履修する価値はありますが、理解が難しいところもあります。,3.55
代謝のメカニズムがとても多くて理解が大変でした。,3.4
FIT AIM かくこと,3.64
レポートは必ず期日以内に出すようにしてください。,3.83
とても大事なことばかりなのでしっかり予復習するようにしましょう。,3.3
舐めていたらやばい講義,3.48
一回一回の授業の復習をその日のうちにやらないとついていけなくなる。,3.06
出せなかった課題が沢山あり、すみません。,3.44
休むと評価を受ける機会を失うことになるので、なるべく休まないように‼︎,3.35
課題提出など、やるべき事をやりましょう。,3.5
オンライン授業だったので勝手が違うかもしれませんが、先生の話を聞くだけではなくちゃんと頭に入れないと中間でほとんど忘れた内容が聞かれてボロボロになるかもしれません。成績には入らないらしいですが気にするなら気を付けておいたほうがいいと思います。頑張ってください。,3.1
英語はとても難しかったです,3.55
ノート提出をしっかりする,3.75
材料力学についての理解を授業や演習で深めることができました。,3.41
いま起きている社会問題や経済のことなど知っているようであまり知らないことが多くためになった。,3.36
テストの内容が気になります。,3.33
復習をしっかりとすること,3.32
しっかりと復習すること,3.28
必修のなかで一番勉強しておかないとテストがきつい教科だと思います。,3.52
予習は難しいと思うが、復習は毎時間ごとに行った方が後のためになると思います。,3.53
友達を作ろう。話しかけないと何も始まらないぞ,3.85
毎回レジュメに記入が必要,3.52
課題で自分でまとめないといけないないので勉強しやすかった。,3.68
大量にある資料を捨てないこと,3.57
予習復習をしっかり行わないと、内容がわからなくなります。,3.33
課題がたまに難しかったです。,3.37
レジュメを毎回書きましょう,3.48
大変難しいと思う学生が一定数いると思うので周りに解析を理解できる人を見つけて早い段階で質問して分からないところを潰していくのがいいと思います。,3.0
授業内容はとても簡単なので出席すれば単位を落としたり置いていかれることはないです。絶対履修登録した方がいいです。,3.22
再履修ならないように頑張ってください,3.44
期末試験は持込不可なので、中間試験が終わったら少しずつ復習する必要があるかと思います。,3.16
授業課題の提出期限日が今まで日曜までだったのにある日急に金曜になってたことがあって間に合わなかった。悔しかった。,3.58
公式などの理解をしっかりと理解しないといけないと感じました。,3.5
先生のテスト前プリントを解く。,3.4
プログラムがどのように動くことで実行結果が表示されているのかの解説が丁寧でとても理解しやすかったです。,3.82
ヘイフリック限界とテロメア領域,3.04
授業内レポートが多いので出席しないと点数はありません,3.7
高校で化学を習っていない人には少し難しい範囲もあります。,3.25
回路に組み込んだ端子の働きと、電気の動き。,3.46
毎回、小テスト(単語テスト)があるので、計画的に取り組むことが必要。,3.6
分野別のテストのときにきちんと点数をとっておきましょう,3.54
板書は絶対に行ってください。,3.39
自分は定理を理解できていないから数学が解けないことが分かった。,3.44
しっかりとレポートに取り組む。,3.69
実験1つ1つの内容を理解することが難しかった。,3.42
課題やその模範解答での問題番号のミスや誤表記が多かったのでもっとよく確認してからアップロードしてほしい。,3.06
「発展課題」は授業中にやっていた演習問題のことでしょうか。もう少しヒントが出せるよう考えてみますね。どうもありがとうございました。,3.37
授業はしっかり聞くこと,3.46
自分の意見を恥ずかしがらずに主張する。,3.42
予習をすることをおすすめします。,3.58
予習、復習をしっかりする,3.6
班のメンバーによって進度が全然変わってくるから結構運ゲー感はあります。つまずいたらすぐ先輩に頼ったほうがいいです。,3.64
話がまとまっていないように感じて聞きにくかった。,3.0
レポート提出わすれずに。,3.4
大人数に対して授業をしているのにも関わらず、ひとり一人に質問するため非効率的 そのためQ&Aというシステムがあるため重要なことのみを質問をある程度理解している人にするべき 演習問題を解く時間をより設けるまたは解けていない問題を課題にするべき 授業中の演習時間が少なく定着ができていない、また演習問題を解く時間がないことから この単元の具体的な問題などが分からないことで復習が疎かになる わかりやすくしようとするあまり補足説明が多く逆にわかりずらい 短くすることで演習問題を解く時間を多くとれる,3.65
分からないことは質問しよう,3.4
教科書を買っておかないと詰みます。詰みました,3.45
少し進むのが早かった。スライドを写そうと思っても、早くて書き写せない。また、先生の話とスライドを書く時間が一緒なので話がほとんど聞けなかった,3.22
トイレに自由に行かせないこととスマホをカバンに入れて充電をすることに関しては許していただきたい。,3.15
テストがマジむずい。分からん。,3.38
ヒールの足音が気になる,3.45
数学が自分が思っていたよりも難しく、全く歯が立ちませんでした。しかし友達と課題を解決していく力が身についたので良かったと思います。,3.37
できれば例題は解いているところを映してほしかったです。,3.66
数学が得意な人は受けた方がいい,3.21
分からないところをほったらかしにすると後悔します,3.67
レジュメを記入しましょう,3.45
課題は模範解答を先生がアップしてくれているので問題ないが、テストの難易度がとても高いので覚悟しておいてください。,3.73
ちゃんと受けた方がいいです。 イヤホンしちゃダメ！,3.46
実験で何をするかくらいは頭に入れておいた方が良い,3.67
"松尾先生の講義は主にExcel,Wordなどを使用して、レポート作成やプレゼンテーションなどをした。これから先、沢山のレポートやプレゼンテーションをすることになるのでいい経験をさせていただいた。内田先生、三宅先生の講義は、データ数や処理時間の計測をして、レポート作成やレビューをした。難しい部分もあり、苦戦を強いられる所も多々あったが将来に役立つと思うのでそれを活かして頑張りたい。",3.38
この授業では、主に健康を題材として英語を学びました。 単語の中には今まで習っていなかったマニアックな単語や、知っている表現と同じ意味での違う表現などもあり、本文を通してしっかり学べたので良かったと思います。,3.5
レポート期限を守ることが大切です。,3.41
レポートはこれから多々あるのでおろそかにできません,3.6
きちんと出席し、レポートを毎回期限を守って出したほうがいいです。,3.66
課題は早めに終わらせておくことが大切。,3.76
先生の解説が丁寧だった。 後半の問題の解説をパソコンにあげて欲しい,3.55
今まで知らなかった福岡や九州の歴史を知れて楽しかった。,3.48
法律の観点から差別やいじめなどもう一度見直すきっかけになった。,3.49
どのような技術が存在するか調べてみてください。,3.83
抽選倍率が高いので早めに抽選申し込みをしよう！僕は3回目でやっと取れました…。,3.58
この3ヶ月間お疲れ様でした。,3.54
課題を提出しましょう。,3.72
インターネットで調べることもする。,3.65
授業中にやっちゃいけない事があるのでそれをやらない。要するに普通に受ければ良いだけです。授業態度が悪かったら単位は取れません。,3.2
式が沢山あって正直難しすぎた復習もっとしておきたい,3.51
毎回ある小レポートは、とりあえず期限までに出せばどうにかなりそう,3.56
課題のプリントで中心線と元々書かれている図形がずれていたりして少しやりづらかった。,3.7
初回授業で資料は後日配布するとお話しされていましたが、資料が配布されないので最終レポートが不安です。,3.45
電気回路の理解を深める面白い講義でした。電気工学基礎の理解に役立つ内容でした。逆もまた然りです。,2.73
予習課題の存在を忘れてしまったことがあまりよろしくないことだと反省しています。,3.46
スマホで遊んでいる人がいると、連帯責任で期末テストが持ち込み不可になってしまうので、真面目に先生の話を聞いて授業を受けるようにしてください。,3.45
繰り返すことが大事になってくる。,3.5
講義自体はとても楽しかったし、やりがいもありましたが、グループの中で各々の仕事の量が均等でないグループが散見されました。私のグループもその一つです。グループを統率しきれなかったリーダーの責任と言えばそれまでですが、CSも多くいる授業なのでもう少しグループの活動を細かく見てほしかったと思います。最後になりますが、色々な研究や、グループで活動すること自体は本当に楽しかったです。ありがとうございました。,3.45
楽しかったです。ただ、ビデオの内容をもう少し考慮していただけると助かります。朝から人がバンバン死ぬやつやセクハラ等の胸糞映画はあまり見たくなかったです。,3.57
どのようにすればモーターが回るのかいろいろ試行錯誤しました。,3.47
予習、復習をしていた方が良いと思います,3.56
授業中の話をしっかり理解できるように聞いておくようにしましょう,3.27
わかりやすかったが課題が大変だった,3.78
できれば、オンデマンド授業を少し減らしてほしい。,3.67
この科目のテスト勉強は、一週間前から始めても手遅れです。,3.75
無遅刻、無欠席で早めの作業を意識すること。,3.54
授業のスピードが速くノート取れない,3.42
ノートをしっかりとる。,3.45
毎回感想を書くけれどそんなに時間がかからない,3.64
初めて知ることが多くあったので、復習の時間をもっと設けるべきだと感じました。,3.57
民法のことがよくわかりました。不法行為のことや事務管理のこと、免責事由がどんな時に使うのかがわかりました。,3.66
先生が作ったプログラムを打つだけじゃあまり理解できなかった,3.27
教科書の予習をしていかないと講義についていけません。,3.53
課題はすべて期限に出す,3.73
fit-AIM準備シートは、しっかりと書いていた方が良いです。,3.54
大事なところなどを、重点的に教えてほしかったです、また、途中で先生の説明がとまることも多々あった,3.44
授業の進捗が自分的にはとても速いと感じた。,3.12
演習問題の解答や、解説動画などあれば授業資料などに公開して欲しいです。 欠席した時の演習問題を解こうにも解答が分からず困ることがありました。,3.4
心理学ってこんな感じなんだなと思った,3.45
字が見えにくいときがありました。,3.39
事前学習用の動画があることでとても学習しやすかった。,3.51
計測器や誤差のやり方をやる,3.25
反復で問題を解くことが大事,3.0
主張反論の作り方について詳しく学べました。,3.48
遠隔授業ということもあり、先生とのつながりを感じれることもなく、課題を提出しても何の反応もないのでいろんな不安を感じた。,3.78
コバルト（Ⅲ）はわかるんですけど、どれがⅡとかⅠとかわからないです。,3.36
メモをとってください。,3.64
提出物はちゃんとだすこと。,3.39
授業中の声が小さく聞こえない。ボソボソ喋っているので何を言っているのか分からない。テストの点数での評価しかないが、テストのレベルが高すぎる。,3.42
社会的なことを学べるので興味のある方は履修しましょう。,3.54
小テストを毎回行うことで分かりやすく理解を深めることが出来てよかった。,3.57
レポート課題は最終提出だが、貯まると多いのでコツコツ終わらせたほうがいい。,3.66
パワーポイントのみでの理解が大変でしたが、自学の力が尽きました。,3.36
予習をしないと席がありません,3.48
法律に興味がない人はおすすめしない。テスト時は持ち込みOKだが、見る場所も多いため難易度としては高い方だと思う。,3.63
課題が多すぎるので減らして欲しい,3.27
半年間ありがとうございました,3.55
授業資料を印刷しておいたほうがいい。,3.48
提出物はちゃんと出した方がいい。,3.2
テストが持ち込みありでも難しかったです,3.56
企業がどのようにできているのかが分かった。,3.55
電気回路の過渡現象は理論を知ることだけではなく、機械設計においても考慮しなければ故障の現認になりかねないという重要な現象であることが理解できた。,3.37
コロナ禍で感染が広がっている中通学するのは少し怖いです。,3.42
テストの答案を返却して欲しいです。どこが間違ったのかやどういう間違いかたをしたのかわからないので。本当にお願いします。,3.55
レジュメをしっかりと復習することとメモをとりながら授業にのぞむ。,3.6
初めてプログラミングをしたので難しかった。,3.6
プログラム関係の就職を目指している人は避けて通れない教科です。,3.3
課題を期限以内に出せるようにしたらいい,3.53
勉強しないと受かりません。,3.2
FIT-AIMの期日を見る,3.34
マナーに関して厳しいですが、授業の内容は楽しいです。マナーに気をつけて講義を受けて下さい。,3.75
お疲れさまでした。オンラインの授業は、大変だったと思います。 私自身、至らないこともたくさんあって、ご迷惑をおかけしました。 コメントをいただいたこと、今後の授業にも生かしていきたいと思います。,3.5
ロボットの便利さに対して危険な部分もあるということを映画や講義を通して学んだ,3.49
プリントを毎回メモして、教科書にマーカーをひく,3.57
課題が毎回出るので先生の話をきちんと聞き重要なところなどメモをとる。,3.46
生物学実験では様々な実験をすることが出来た。 実験Bが少し変わったりしたがそれ以外は不自由なく実験でき、成功できたのでよかった。 実験Bのレポート変更の際通知がなく、クラスプロファイルを確認しておかないと変更内容が確認できなかったので少し不便だった。,3.69
先生が話すだけの授業なので、あまり頭に入ってこなかった,3.29
前期よりもプログラミングの専門的知識が大幅に増えたと感じた。,3.73
教科書に書き込みをしていくと分かりやすいと思います。,3.41
英語の内容は難しくなかったです。ただ解説がたまに早くなっていつのまにか終わっていることや、授業後半になると騒がしくなってしまうのが持ったないなと思いました。生徒側の問題ですがそう言った雰囲気にならないようしていただけると助かります。,3.13
教科書は買った方がいいかもしれない。,3.55
「オフィスアワーに行ったとしても何も得られず」：時間内には、点数増加にむけて直接的な指導をしたつもりですが、すいません。（次年度学生へ）本講義には、教員によるオフィスアワーに加えて、学生ＳＡにより学習相談コーナーがあります。オフィスアワー利用は少ないので、何か得られるまで毎週通ってください。,3.32
講義内でするプリントを何度も解く。,3.84
貧困問題は深刻である。なぜならば、貧困者の生活が困難になり、環境にも影響を及ぼすということを理解できました。,3.54
javaの課題が鬼ムズイ,3.56
授業や学期末での課題で忙しい中、ご回答、どうもありがとうございました。アンケート結果やいただいたコメントは、今後の授業にも活用させていただきます。 Formsの予習や授業動画を視聴するのは、大変だったと思います。どうもお疲れ様でした。 古川武史,3.33
理解度テストは、プリントから出るので、そこまで難しくはないです。,3.68
期限内に提出することができた,3.48
映画が思ったより強烈すぎた,3.66
英語の勉強方法を教えてください。もっと英語ができるようになりたいと感じました。,3.27
初めて見るものや触るもの、学ぶことばかりだったので大変だと感じた,3.69
最後が難しくなるので頑張ってください。,3.6
わかりやすい説明でした。,3.35
課題提出 出席をしっかりする,3.48
スライド進むの早すぎます！,3.54
手描きノートしかテストで持ち込めません。,3.38
姿勢、服装、授業態度で注意されたことがある人は要注意。これらのマナーに関する厳しさは全講義の中でもトップクラスに厳しいです。 授業ごとに短い感想文レポートを書かせられるので作文、小論文が得意な人には向いているかもしれません。,3.36
解説がとても分かりやすかったです。しかし、やむを得ず欠席しなければいけないときに、周りに理解している人が少なく、わからないことがありましたので、問題の回答がないので、不安になりました。,3.12
毎講義、具体的な目標を設定してから受講すると課題が早く終わると思います,3.65
しっかり話を聞いてノートをとってください,3.64
様々な視点から環境について学べた。,3.48
遠隔講義であったため、分からないことがあったときに質問がすぐできない状況が少し不便だった。,3.44
高校で生物を勉強してない人は途中少しきつくなるかもしれません。,3.3
小テストは必ずしてください。,3.42
授業を聞いて、宿題は必ず守りましょう。、,3.58
もう少し授業スピードあげても良いかもしれません,3.22
課題が難しかったです。,3.3
材料にどのような性質があり、どのような現象が起こり変化したのかなどがわかったので良かった。,3.38
宿題は期限内にやろう。,3.61
内容的に、先生の話を聞き板書を書き写せば解けるようになります。,3.72
過去や海外の環境問題、政策を学ぶことができました。印象が強かったのは、公害に向き合わなかった企業は現在、生き残っていないという言葉です。本当にそうだなと思いました。,3.57
課題を継続してすることで内容を定着させることができた。,3.5
